Orthogroup	Species	Zebrafish.UniProt.renamed	Orthologs
OG0000001	Human.UniProt.renamed	A0A8M9PE23, A5PMB3, A0A8M9PS52, A0A8M6Z426, A0A8M9PE76, A0A8M9PDV0, A0A8M9P890, A0A8M9PKD5, A0A8M2B8F9, F1Q5S4, A0A8M9PP06, A8E5B1, B8JM00, A0A8M2BHQ4, A0A8M9P4B8, A8E518, E7F8E6, A0A8M2BHP6, A0A8M1QL07, A0A8M2B8D7, A0A8M6Z3E5, A0A8M9PE04, A0A8M2B8G5, A0A8M9PVA5, A7YYC8, A0A8M1N456, A0A8M9PVF6, A0A8M9P4W0, A0A8M3AXE7, A4FVL9, A0A8M9PE09, A0A8M9PRY4, A0A8M2BI54, A0A8M1RMZ5, A0A8M3ALZ3, A0A8M2B8I7, A0A8M3ALZ9, A0A8M9PRX3, A0A8M9PV55, A0A8M9P4D0, A0A8M9PVE7, A0A8M9PJP4, A0A8M6YUX9, A0A8M9PW45, X1WDD7, A0A8M9PJS0, A0A8M2BHN9, A0A8M3AMP5, A0A8M6Z490, A0A0R4IM72, A0A8M2BHQ1, A0A8M9PE81, A0A8M2BHR0, A0A8M2BI49, A0A8M2BHN5, A0A8M3AMR5, A0A8M3AMP1, A0A8M3AXC1, A0A8M6Z3I1, A0A8M3AUD3, A0A8M9PE19, A0A8M6Z3I5, Q1LW50, A0A8M6YXF3, A0A8M9PEQ5, A0A8M3B570, A0A8M9P4V6, A0A8M6Z493, A0A8M2BHP9, A0A8M9PE28, A0A8M6YVL0, A0A8M2BHR7, A0A8M9P4D7, A0A8M2B8K9, A0A0R4IKB5, A0A8M9PVH6, A0A8M9PKD9, A0A8M3AM14, A0A8M9PW50, A0A8M3AUE7, A0A8M2BI59, A0A8M2BHQ7, A0A8M2BHP7, A0A8M3B590, A0A8M3AUD6, A0A8M1RFS5, A7MC87, A0A8M9PRZ7, A0A8M6Z485, A0A8M3B593, A0A8M6Z2H8, A0A8M9PVH0, A0A8M9PSP4, A0A8M1RJG8, A0A8M9PVG6, A0A8M9PJR6, A8DZC6, A0A8M2BHQ9, A0A8M6YVK8, A0A8M9PRZ3, A0A8M6YV33, A0A8M9P4D6, A0A8M6YVM0, A0A0R4ICM8, A0A8M3AM19, A0A8M6YV29, A0A8M9PSP9, Q5EAQ0, A0A8M2BHQ2, A0A8M1RI04, A0A8M3AM09, A9JRP4, Q58ER6, A0A8M3AM57, Q32PP4, A0A8M2BLA9, A9JRB0, A0A8M3AUK6, A0A8M6Z3H8, A0A8M9PV61, A0A8M2BLB1, A0A8M9PS36, A0A8M2B8K0, F1QII2, A0A8M6Z5J9, A0A0G2KE12, A0A0G2KH00, A0A0G2KSD8, Q5BLB9, A0A8M1QUS0, A0A8M3AL62, A4VCH2, A0A8M6YWW6, B3DG10, A0A8M1QLN4, Q5EAQ6, A0A8M2B7W3, Q567X4, Q58EF6, A0A8M9PIJ8, A0A0G2L2X0, A0A8N7UQR0, A0A8M1Q1J8, A0A8M9PIJ4, A7MBN8, A3KP61, A0A8M2B7W7, A0A8M2B7V8, A0A8M9QBY4, A0A8M9QMK6, E7F7V9, A0A8M9PXU7, A0A8M9P7M9, A8KB54, A0A8M3ALV3, A0A8M6YV89, E7F7C6, A0A0R4IFM9, E7EZP5, A0A8M6YWZ1	Q8N8Y5, Q9BWE0
OG0000002	Human.UniProt.renamed	A0A8M2B8I0, A0A8M2B8C9, A0A8M3B583, A0A0R4IIT7, A0A8M2B8K2, A0A8M9PA83, A0A0G2L6Z5, A0A8M6YZC7, A0A8M6Z578, A8E5D2, A0A8M9PNH3, A0A8M3AXM5, A0A8M6YWQ4, A0A8M6YXE1, A0A8M9PNH9, A7MCG4, A0A8M9PZT6, A0A8M9PLJ1, A0A8M2B5W2, A0A8M9PZT1, Q5BLG9, A8E506, A0A8M9PTT9, A8KBK0, A0A8M9PRG0, A0A8M9Q018, A0A8M9PU09, A0A8M6YY38, A0A8M9PGW4, B1WB80, A0A8M9PXX4, A0A8M9PTU3, A0A8M9P8J5, A0A8M9Q1M8, A0A8M9PI92, A0A8M9QC89, A0A8M2B449, A0A8M9PGW1, A7MCB3, A0A8M9QC11, A0A8M9PHN8, A0A8M9PI20, A0A8M9Q6J7, A0A8M9PIA3, F1R3N6, A0A8M9PZD7, A8WGK9, A0A8M9Q1S0, A0A8M9QCX6, A0A8M6Z6I0, A8WGK4, A0A8M6YYY3, A0A8M9PWI5, A0A8M9Q255, A0A8M6Z4R4, A0A8M6YYK5, A0A8M9Q7I4, A0A8M9Q1G5, A0A8M6YYS8, A0A8M9Q664, A0A8M9PJS9, A0A0G2KLM8, A0A8M9Q6K4, A0A8M9Q2F1, A0A8M9Q7E9, A0A8M9Q1T5, A0A8M9PVT6, A0A8M9Q1X8, A0A8M9Q039, A0A8M9Q291, E7F6B3, B0JZK2, A0A8M9QBJ8, A0A8M9Q828, A0A8M9QCZ3, A0A8M6Z4U7, A0A8M6YYQ1, A0A8M9Q640, A0A286YB60, A0A8M9PIP6, H0WE42, A0A8M6Z5G2, A0A8M9PW70, A0A8M6Z5X4, A0A8M9QB85, A0A8M1QVG4, A0A8M6YYG0, A0A8M9PIL8, A0A8M6YYP7, A0A8M6Z062, A0A8M9PVZ0, A0A8M9QBK4, B0JZJ0, A0A8M9PVE0, A0A0R4IFY6, A0A8M9Q7C6, A0A8M6Z671, K7DY82, A0A8M9Q1A4, A0A8M9PI48, A0A8M9Q192, A7YYB7, A0A8M9QCG2, A0A8M9Q280, A0A8M9PW38, H0WE47, A0A8M6Z080, A0A8M9PUX2, A0A8M6Z073, A0A8M6Z043, A9JRR4, A0A8M9Q0U4, A0A8M6Z059, A0A8M6YXH4, A0A0G2L199, A0A8M1PU54, F1QJG9, A0A0G2KZN8, A0A8M1QKP2, A0A8M3AGZ9, X1WDJ1, A0A8M2BIG9, F1R7V0, Q5J2I5, Q5BJ00, A0A8M3B7J0, A0A0G2KI00, A0A2R8QGS5, B0VJZ9	P17041
OG0000004	Human.UniProt.renamed	A0A8M9QD26, A0A8M9Q1U3, A0A8M9QCD6, A0A8M6Z051, A0A8M9Q7G5, A0A8M9PVW8, A0A8M6Z5T5, A0A8M9Q0W9, A0A8M9QD04, A0A8M9PIN6, A0A8M9QCB6, A0A8M9Q6V3, A0A8M9PIX6, A0A8M9PWE4, A0A8M6YYA9, A0A8M6Z039, A0A8M9QCV5, A0A8M9QCY4, A0A8M9QC86, A0A8M9Q7D1, A0A8M9Q7E5, A0A8M9Q6Z1, A0A8M9Q7C7, A0A8M9PIS4, A0A8M9PIV5, A0A8M9PNL1, A0A8M9PVF9, A0A8M9PVE5, A0A8M9Q1L5, A0A8M9PIX2, A0A8M9Q1F4, A0A8M9PUU1, A0A8M6Z5Z1, A0A8M9PNX1, A0A8M9Q767, A0A8M9PNC6, A0A8M9Q1P2, A0A8M9QB88, A0A8M9QC16, A0A8M9Q6L5, A0A8M9QCX9, A0A8M9PIR6, A0A8M9QCL2, A0A8M9PVQ8, A0A8M9PVK5, A0A8M9Q1L1, A0A8M9Q1S4, A0A8M3ARU5, A0A8M9QC22, A0A8M9Q1W9, A0A8M9PI96, A0A8M9PWH7, A0A8M9Q238, A0A8M9PIZ7, A0A8M9PNK1, A0A8M9PVD0, A0A8M9PWG3, A0A8M9PVB5, A0A8M6Z695, A0A8M9Q260, A0A8M9PIK6, A0A8M9Q6Y3, A0A8M6YXR1, A0A8M9QCX2, A0A8M9Q6Q7, A0A8M9Q6K6, A0A8M9PI30, A0A8M9PW58, A0A8M9QCZ6, A0A8M3AZ18, A0A8M9QBN5, A0A8M9PWA4, A0A8M9PIE2, A0A8M9Q6I4, A0A8M9Q6D9, A0A8M9PWD0, A0A8M9PNS7, I3ISW0, A0A8M9PS19, F1QLN7, A0A8M6YZP9, A0A8M9PWK9, A0A8M9PGP4, A0A8M6YV39, A0A8M1PS56, A0A8M2BBI2, A0A8M9QAM1, A0A8M3B8L6, A0A8M6YWV8, A0A8M3AZZ6, A0A8M6Z565, A0A8M6YTE4, A0A8M9Q5L8, A0A8M9PTV5, A0A0R4IS41, A0A8M9PLJ6, A0A0R4IX00, B8A688	Q8N3J9, Q6ZT77, Q49A33, Q7Z3I7, P17026
OG0000012	Human.UniProt.renamed	A3QJU1, A5WUG5, A0A8M9Q143, A5WUH2, A0A8M1RF17, F6NS67, A0A8M6Z781, A0A8M9Q208, A5WUJ2, A0A8M6Z1F0, A3QJU0, A0A8M9QHC1, A0A8M9PP80, A0A8M1N7H3, Q5RFX3, A0A8M1P3G7, A0A8M6YZA0, F6PE05, A5WUG7, A4FVG7, A0A8M1N7C8, A0A8M9QCB2, E7F3U7, A0A8M6Z756, Q1L8A7, E9QE43, A0A8M9Q857, A0A8M9PPA0, A0A140LFQ6, E9QE57, A0A8M6Z1Z1, E9QJ87, F1QC82, A0A8M9QCC2, A8HAJ4, A0A8M9QGK7, A0A8M1NE49, A0A8M6Z1M0, A0A8M6Z0C6, E9QEL4, A0A8M3BAR6, A0A8M9Q9A5, A0A8M9Q862, A0A8M9PMY8, F6NUW0, A0A8M9Q1F6, A0A8M9QC77, A0A8M9Q648, B3DHH3, A0A8M9Q1X4, A0A8M1RS52, A0A8M2BE28, A0A8M9Q294, A0A8M3AJD0, A0A8M1RJF5, A0A8M1PUI7, A0A8M9PDA6, A0A8M3B0I5, A0A0G2KJW0, A0A8M6Z1C8, A0A8M9PLF6, A0A8M9Q356, A0A8M9NYS8, A0A8M9QI91, A0A8M9QIB4, A0A1L1QZJ4, A0A8M9Q9C7	Q6ZU45
OG0000014	Human.UniProt.renamed	A0A8M1QV59, A0A8M3B823, F1Q8X3, A0A8M2BH17, A0A8M6YWX7, F1RBS9, A0A8M1PSH1, X1WE97, A0A8M9PZX5, A0A8M2BBM2, A0A8M9Q5N6, A0A8M6Z5N1, A0A8M3ATA4, A0A8M9PL13, A0A140LGH1, A0A8M9Q2S6, A0A8M9PLJ2, A0A8M2B8Q3, A0A8M1QHQ9, A0A8M3AWJ6, A0A8M6YVD1, A0A8M9PJL2, A0A8M6Z575, A0A8M9PM89, A0A8M6YXT6, A0A8M6YXJ2, A0A8M3AQK7, A0A8M9PS21, A0A8M2B4Y6, A0A8M1PV89, A0A8M9PL17, A0A8M9PTD4, A0A8M9PZB8, A0A8M9PKE5, A0A8M3B0M8, A0A8M6Z535, A0A2R8RJF7, A0A8M3ATP6, A0A8M9QAR5, A0A8M2BBT9, A0A8M9P9N7, A0A8M9P9Q9, A0A8M9P8K4, A0A8M6YWM5, A0A8M6Z4Z0, A0A8M6YZ46, A0A8M9PZA8, A0A8M9PKW8, A0A8M9P9S3, A0A8M9PRW0, A0A8M2BLY7, A0A8M9PZW6, A0A8M6Z5U5, F1RDB1, A0A8M9Q5N0, A0A8M9PTV9, A0A8M9PZW1, A0A8M9Q306, A0A8M9PQC7, A0A8M3B5R2, A0A8M2BLS2, A0A8M1PT33, A0A8M9P1V9, A0A8M9P8F0	Q7Z2Y8
OG0000025	Human.UniProt.renamed	A0A8M3AYE0	A0A0A0MRZ8, P04433, A0A0C4DH25, P01619, A0A075B6H7, A0A0C4DH90, A0A0C4DH55, A0A087WSY6, P01624, A0A075B6S6, P06310, A0A075B6R9, A0A0C4DH68, A0A0A0MRZ7, A2NJV5, A0A075B6S2, P01614, A0A087WW87, A0A075B6P5, P01615, P06312, A0A0C4DH26, A0A0A0MT36, A0A0C4DH24, P06315, Q15116, P09564, A0A075B7D4, P01593, P01594, P0DSN7, A0A075B6S9, A0A075B6S5, A0A0G2JRQ6, A0A087WSZ0, A0A0C4DH67, A0A0B4J1Z2, P01599, A0A0C4DH72, A0A075B6S4, A0A0C4DH73, P01611, P04430, P01601, P01602, A0A0B4J2D9, P0DP09, A0A0C4DH69, A0A075B6H8, P04432, P01597
OG0000030	Human.UniProt.renamed	A0A8M3B7Y5, A0A8M9PWT7, A0A8M9Q1Q5, A0A8M9PQH4, A0A8M9Q9B4, A0A8M9PQI5, A0A8M9Q1U4, R4GDV0, A0A8M9QC70, A0A0G2KUY7, A0A8M1RSB5, A0A8M1NHQ0, A0A8M9Q338, A0A8M6Z1E6, A7YY96, A0A8M9QI99, B3DIJ3, A0A8M6Z7H8, A0A8M9Q995, B0S637, A0A8M6YXJ7, A0A8M1QH75, A5PLE9, A0A8M9PXX6, A0A8M9PJL7, A8WFZ9, A0A8M9Q292, A0A8M2BB16, A0A8M9PZC5, A0A8M6YZM0, A0A8M9PXW0, A0A8M1PZ52, A0A0G2KPB1, Q08CV6, A0A8M2B6W1, A0A8M3AR62, A0A8M6Z0D2, A0A2R8QU83, A0A8M9PX94, F1QIR3, A0A8M3AQ50, A0A8M1QL23, A0A8M9PQF0	Q8ND71
OG0000031	Human.UniProt.renamed	A0A8M6YTL5, A0A8M3B6K0	Q9UDY6, Q9C019, Q12899, Q9BZY9, Q6P9F5, Q9H2S5, Q9C029, Q8WV44, Q96A61, A0A3B3IT33, Q9BSJ1, A6NDI0, P0CI26, P0CI25, Q8IWZ4, C9J1S8, I1YAP6, A6NCK2, Q96BQ3, A6NGJ6, A6NI03, A6NLI5, Q8N9V2, Q8N7C3, Q9C037, Q9Y577, Q96F44, Q5TA31, Q9C035, Q9BYJ4, Q8IYM9, Q9C030, P19474, O00635, Q8NG06, Q6AZZ1, P14373, O15553, Q9HCM9, A6NK02, Q495X7
OG0000033	Human.UniProt.renamed	A0A8M9PLT5, A0A8M9QCM4, A0A8M9Q3F7, A0A8M9QCM8, A0A8M9QCV4, A0A8M9Q065, A0A8M9PLU5, A0A8M9PLU9, A7YYA4, A0A8M9PMS7, B8A626, A0A8M9QG75, A0A8M9QK16, A0A8M6Z9M5, A0A8M9Q128, A0A8M9QAR7, A0A8M9PTZ3, A7MC74, A0A8M9PMV6, A7MC75, A0A0R4IHT1, A0A8M9Q149, E9QFX7, A0A8M6Z3U6, A0A8M9PIN3, A0A8M1RRS1, A0A8M9P3J2, A0A8M9PDK3, A0A8M9PQU3, A0A8M6Z365, A0A8M2B7W6, A0A8M9QP02, A0A8M9QKF1, A0A8M9QLE8, A0A8M9Q060, A0A8M9PYY8, A0A8M9PTZ8, A0A8M9PBC7, A0A8M9QG79, A0A8M9QC71, A0A8M9Q6Y4	O43464
OG0000035	Human.UniProt.renamed	Q1L9F9, Q6PGW1, A8WG90, I3ITQ0, A0A8M9Q7M1, F2Z4W9, A0A8M2BHW3, B8JLS7, F1R7D2, A0A8M1Q7P5, A0A8M1PZW6, A0A8M2BIV5, F1QMZ7, A0A0R4IV10, A0A0R4ICE2, F1QWI8, A0A8M9PAX5, A8WG17, A0A0R4IJZ5, A0A8N7TEP3, Q1MT09, A0A8N7UV72, Q1MT11, A0A8M1QHK9, A3KH08, A0A0R4IPB1, A0A0R4IIJ3, A0A2R8RZP6, Q58EJ1, Q5U3I5, F1QZQ5, F1QSW1, A0A8M1PZV1, A9JTD1, A0A0G2L0E2, A0A8M1RM68, A0A8N7TBF6, A7MBU2, Q503E5, A0A8M9QAN4	Q9UPQ4
OG0000038	Human.UniProt.renamed	A0A8M6Z629, Q5RG00, A0A8M9Q3D5, A0A8M9PBQ5, A0A8M9PIM7, A0A8M1PRW6, A0A8M2BB39, A0A8M9PQV0, A0A8M2BLV9, A0A8M9PKD1, A0A8M9QAH4, A0A8M9Q7J2, A0A8M9P618, A7MD75, I3IT02, A0A8M3AH58, A0A8M9Q541, A0A8M6YVE0, A0A8M9PYE6, A0A8M9P2T4, A0A8M9Q2W1, A0A8M2B4L7, A0A8M3B996, A0A8M9PFB3, A0A8M9PJI0, A0A8M6YZS0, A0A8M1Q1H2, A0A8M1QKD0, A0A8N7T5W2, A0A8M2BAU4, A0A0R4IB49, A0A8M3AVU4, A0A8M1QVG7, A0A8M6Z6G1, A0A8M3AYF1, A0A8M9P5L6	Q8N6K7
OG0000052	Human.UniProt.renamed	Q6DHS1	P62736
OG0000052	Human.UniProt.renamed	Q6IQL9	P68032, P68133
OG0000052	Human.UniProt.renamed	Q7ZVF9, Q7ZVI7	Q9Y615, Q9Y614, Q8TC94, Q9H568, Q9BYD9, Q8TDY3, Q8TDG2, P63261, P60709, Q6S8J3, A5A3E0, P0CG38, P0CG39, Q9BYX7, A6NI47, Q6S5H5, Q6S545, Q6S8J7, Q86YR6, B2RU33, A0JP26, H3BUK9, A0A0A6YYL3, Q562R1
OG0000055	Human.UniProt.renamed	Q7T0K5	Q9UJ55, Q96MG7, Q9HAY2, Q9H213, A0A0J9YX57, Q8N7X4, A8MXT2, P43366, O15479, O15481, O15480, Q9BZ81, Q96LZ2, Q96M61, A2A368, A6NCF6, P43358, P43357, P43360, P43365, P43356, P43359, P43355, P43361, P43362, P43364, P43363, Q8TD91, Q9UBF1, O60732
OG0000060	Human.UniProt.renamed	A1IH00	Q08379, P0CG33, A6NDK9, A6NDN3, Q9NYA3, A6NEF3, A6NEM1, A6NI86, H0YKK7, Q9HBQ8, A7E2F4, A8MQT2, P0DX53, P0DX52, Q0D2H9, A6NN73, H3BPF8, F8WBI6, H3BV12, A6NCC3, I6L899, H3BSY2, A6NC78, A6NMD2, P0CJ92, D6RF30, A0A1W2PRN1, H3BQL2
OG0000066	Human.UniProt.renamed	F1Q7C9	Q8NH07, Q8NG94, B2RN74, Q8NGZ6, O95222, Q8NH79, A6NL08, Q96RD1, Q9NZP0, A6NM76, A6NJZ3, A6NF89, A6NIJ9, A6NDL8, Q9NZP2, A6NCV1, Q8NGE1, Q8NGE2, Q8NGM8, Q8NGC5, Q8NGN1, Q8NH40, Q8N148, Q8NGT5, Q8NGU1, Q8NGU2
OG0000068	Human.UniProt.renamed	A0A8M9PYM5	Q92527, A2RUR9, Q8IYA2, Q3MJ40, Q6NUI1, Q9UPS8, Q8IVF6, A2A2Z9, Q9H560, Q5SQ80, Q5VUR7, Q5TYW2, Q4UJ75, A0PJZ0, Q5CZ79, Q8NF67, Q6NSI1, A7E2S9, Q9BXX3, Q9BXX2, A6NC57, Q96IX9, A6QL64, Q8N2N9, Q5JPF3
OG0000070	Human.UniProt.renamed	E7F4C0	Q9P275
OG0000070	Human.UniProt.renamed	F1QY38	Q9H9J4, D6R901, C9JPN9, D6RJB6, D6RCP7, C9J2P7, C9JVI0, D6R9N7, D6RA61, C9JJH3, A6NCW7, P0C7I0, Q7RTZ2, A6NCW0, Q6R6M4, P0C7H9, D6RBQ6, C9JLJ4, D6RBM5, Q6QN14, A8MUK1, Q0WX57
OG0000071	Human.UniProt.renamed	A0A8M1Q1Z2, Q6DHH4	Q2L4Q9, Q5K4E3, Q8NF86, Q16651, Q9BQR3, Q9GZN4, Q7RTY5, Q7Z5A4, Q7RTY3, Q9UI38, Q6PEW0, A0A1B0GVH4, Q6UWB4, Q9Y6M0, Q7RTY9, E5RG02, A8MTI9, A1L453, Q9NRR2, A6NIE9, Q9BZJ3, Q15661, P20231
OG0000093	Human.UniProt.renamed	A0A8M9Q572	A0A0C4DH38, A0A0J9YXX1, A0A0G2JMI3, A0A0C4DH33, P01743, A0A0B4J2B8, A0A087WYE8, P01742, A0A0B4J2H0, A0A0C4DH31, A0A0C4DH29, A0A0C4DH39, A0A0J9YVY3, A0A0B4J1V7, P0DTW3, A0A0A0MS14, A0A0J9YW62, P0DP01, A0A075B7D0, P23083
OG0000119	Human.UniProt.renamed	A8KBY5	Q15544, A0A1W2PRN6, A0A1W2PQ09, A0A1W2PPW3, A0A1W2PPL8, A6NLC8, A0A1W2PPH5, A0A1W2PR64, P0DW13, A0A1W2PP81, P0DW14, P0DW11, P0DW12, A0A1W2PPE2, A0A1W2PRV1
OG0000121	Human.UniProt.renamed	Q60I64	Q9Y5I4, Q9H158, Q9Y5H7, Q9Y5H6, Q9UN73, Q9UN75, Q9Y5I2, Q9Y5I1, Q9Y5I0, Q9Y5H9, Q9Y5I3, Q9Y5H8, Q9UN74, Q9UN72, Q9Y5H5
OG0000124	Human.UniProt.renamed	A0A8M9PGB7, A0A8M6YVN8, A0A8M9QFU5, A0A8M9Q943, A0A8M9Q1P4, A0A8M9PL38, A0A8M9PIF9, A0A8M9PJU7, A0A8M2B6N5, A0A8M2B6R3, A0A8M1RN34, A0A8M6Z4A8, A0A8M3AW26, A0A8M1NED1, A0A8M2BK12	Q96DM1
OG0000132	Human.UniProt.renamed	A0A0R4IE87, P52722	P47944, P04733, P02795, P80297, P80294, P0DM35, P13640, P04731, Q93083, Q8N339, P07438, P04732, P25713
OG0000133	Human.UniProt.renamed	A0A8M1NBP6, B6IDE1, A0A8M9PPA1, A0A0R4INI3, F1QZW1	P12883, P13533, Q9Y623, P12882, Q9UKX2, P13535, P11055, Q9UKX3, Q9Y2K3, A7E2Y1
OG0000135	Human.UniProt.renamed	A0A8M9PPC7	Q12836, P60852
OG0000135	Human.UniProt.renamed	F1QUS3, F1QJ26, F1QNI8, F1QMZ0, F1R003, Q98SS0, A7MBW8, A3KP56, Q1RM40, A4QNZ1, F1R4N4	Q05996
OG0000146	Human.UniProt.renamed	A0A8M1QQQ0, E7FFP6, A0A8M9PQK1, A9JRH2, A0A0R4IVU6, Q08BC3, A0A8M6Z2K2, A0A8M2B5V4, B0R0N8, A0A8M3B767, A0A8M2BIK9, A0A8M9P7R8, A0A8M3B2I9	O94919
OG0000150	Human.UniProt.renamed	Q2XVR3	P35499
OG0000150	Human.UniProt.renamed	A0A8M2B935	Q9UQD0
OG0000150	Human.UniProt.renamed	A0A8M9Q653	Q01118, Q15858, Q9NY46, Q99250, P35498
OG0000151	Human.UniProt.renamed	A0A8M2BAG9	Q9ULB5
OG0000151	Human.UniProt.renamed	A0A8M9Q975	P55289
OG0000151	Human.UniProt.renamed	Q2MLR9, Q5WN09	Q9Y6N8, P55285, Q9ULB4
OG0000152	Human.UniProt.renamed	A5HAK1, A5HAK2, A5HAK0	P03950, P34096, Q5GAN4, Q5GAN6, P10153, P12724, Q8TDE3, Q9H1E1, Q93091, P07998
OG0000153	Human.UniProt.renamed	A4JYR0	A0A0A6YYK6, A0A087WT02, A0A075B6T8, A0A0B4J280, A0A075B6X5, A0A0B4J244, A0A0A6YYJ7, A0A0A6YYK1, A0A075B6U6, A0A0B4J262, P01737, A0A0B4J237
OG0000156	Human.UniProt.renamed	Q68EL4	Q96MD7, A0A096LPI5, Q8NEM8, F2Z398, Q8TDM0, Q8N976, Q8N2A0, A6NIU2, Q96T75, Q5T7P6, Q9BUA6, Q8IV13
OG0000158	Human.UniProt.renamed	A0A0R4IXC8	Q9BUF5
OG0000158	Human.UniProt.renamed	Q6NW90	P07437
OG0000158	Human.UniProt.renamed	Q6P5M9	P04350
OG0000159	Human.UniProt.renamed	A0A8M1P8B8, E7F6D1, A0A2R8Q1M9, A0A8M1QKQ6, A0A8M9PK25, A0A8M9P7N2, A0A2R8RQN4, A0A8M6YVB0, X1WE34, E7EYG3	Q6NXR0
OG0000159	Human.UniProt.renamed	Q1LY91	Q8WZA9
OG0000161	Human.UniProt.renamed	A0A8M6YYY2, A0A8M6Z9W4, A0A8M9QGK8, A0A8M3B5N8, A0A8M1RSK8, A0A0R4IS95, A0A0R4INY9, A0A0R4IQV6, A0A0R4ICK5, A0A8M2BL29, A0A8M9PD59, A0A8M3AIT0	Q3KQU3
OG0000170	Human.UniProt.renamed	A0A8M1QLH5	P07199, Q8IY51, Q6B0B8, Q17RP2, Q53EQ6, Q6NT04, B2RD01, Q96MW7, O75564, Q9Y4A0, Q4W5G0
OG0000171	Human.UniProt.renamed	A0A0R4IAR1, A0A8M9PCV3, A0A8M9PKD7, A0A8M9PNE1, A0A8N7UR86, A0A0R4IW80, A0A8M2BH09, E7F0J8, A0A8M9PKG4	A6NC86, O95274, Q03405
OG0000174	Human.UniProt.renamed	B8A516	Q9BQE3
OG0000174	Human.UniProt.renamed	Q6NWK7	Q71U36, Q9NY65, Q6PEY2, P0DPH7, P0DPH8
OG0000174	Human.UniProt.renamed	B8A518	P68366, A6NHL2, P68363
OG0000175	Human.UniProt.renamed	A0A8M6YV12	O60882
OG0000175	Human.UniProt.renamed	A0A8M1Q2B6	Q9NRE1, P09237, Q9H306, P22894, P03956, P39900, P08254, P09238, P45452
OG0000176	Human.UniProt.renamed	B0V329, A0A8M9QIX2, A0A8M1RM46, Q0P402, A0A8M3BBS2, A0A8M9PRR4, A0A8M9QE45, A2RV47	Q92956
OG0000176	Human.UniProt.renamed	A0A8N7TAY6	P25445, P43489
OG0000177	Human.UniProt.renamed	A0A0R4IWE3	Q5T9G4, Q8N2F6, Q9P291, Q7L311, Q7L4S7, Q9UH62, Q5H9R4, Q6P1M9, Q6PI77, Q96D09, Q5JY77
OG0000178	Human.UniProt.renamed	A0A0R4IW50, A0A8M9QKV3, A0A0R4IIR6, A0A0R4IFD2, A0A0R4IN12, A0A0R4IF19, A0A0R4IUN8, A0A0R4IPC1, A0A0R4ITM8, A0A0R4IEA1, A0A0R4IES2	P00995
OG0000186	Human.UniProt.renamed	Q7ZWA3	O75526, Q8N7X1, P38159, Q96E39, Q15415, A6NDE4, P0C7P1, A6NEQ0, P0DJD3, P0DJD4
OG0000189	Human.UniProt.renamed	A0A8M3AZA0	Q96P47
OG0000189	Human.UniProt.renamed	A0A8M3B0C5	Q99490, Q9UPQ3, Q8TF27, Q5VTM2, A6NIR3, Q5VUJ5, Q5VW22, Q96P64
OG0000191	Human.UniProt.renamed	A0A0G2KYH9	P02776, P10720, P02775, Q07325, P02778, P42830, P80162, P09341, P19875, P19876
OG0000192	Human.UniProt.renamed	Q6DHH8, Q49IK6	O00338, O75897, Q6IMI6, P50225, P50226, P0DMN0, P0DMM9, P49888, O43704
OG0000203	Human.UniProt.renamed	A0A8M9PEK9	Q96PC5, Q96RT6, Q8IX95, Q86UF2, A4D2H0, P0CG41, Q8IX94, A0A2R8YE69, A4FU28
OG0000204	Human.UniProt.renamed	Q6DHQ7	O15496
OG0000204	Human.UniProt.renamed	A0JL26	P39877, Q9NZK7, Q5R387, P14555, Q9UNK4, Q9BZM2, Q02509
OG0000205	Human.UniProt.renamed	A0A8M2BKR3	P49238, P51685, P51679, O00590, P32246, P51677, O00421, P51681, P41597
OG0000206	Human.UniProt.renamed	A9JSX7	Q13443, O43506, Q9UKJ8, Q9UKF5, Q9UKF2, Q99965, Q8TC27, Q9Y3Q7, Q6NVV9
OG0000207	Human.UniProt.renamed	Q5RG12	Q58FG0, Q58FG1, Q14568, P07900
OG0000207	Human.UniProt.renamed	O57521	Q58FF7, P08238, Q58FF8, Q58FF6
OG0000208	Human.UniProt.renamed	Q5YF88	Q9GZX7, P41238, Q9UH17, P31941, Q9HC16, Q6NTF7, Q8IUX4, Q96AK3, Q9NRW3
OG0000210	Human.UniProt.renamed	R4GEB4, R4GEK1	Q8TBZ5, O43296, Q5CZA5, Q08ER8, Q14592, Q7Z398, Q96NL3, P51504
OG0000211	Human.UniProt.renamed	Q800E4	Q9UM47
OG0000211	Human.UniProt.renamed	A0A0R4IN59, F1RCH4	Q99466, Q04721, A0A096LNW5, P0DPK3, Q7Z3S9, P0DPK4
OG0000212	Human.UniProt.renamed	A0A8M9PAG6, A0A8M6Z2U7, A0A8M6Z2R9, A0A8M9PYK6, A0A8M6Z1Y5, A0A8M9PN68, A0A8M2B1Y7, A0A0R4IWH1, A0A8M9QN30	O96006
OG0000213	Human.UniProt.renamed	Q14TH1, Q5BKW6, Q4QRC8, F1REP3, A0A8M3AVT9, E7F0X0, A0A8M6Z8J3, A4VCG4, Q1LW01	Q6HA08
OG0000224	Human.UniProt.renamed	Q6PC53	P62937, Q9Y536, F5H284, P0DN26, A0A075B759, A0A0B4J2A2, P0DN37, A0A075B767
OG0000225	Human.UniProt.renamed	A7Y7X5	Q9Y462
OG0000225	Human.UniProt.renamed	A0A0R4ILE1, X1WC64	Q96JM3
OG0000225	Human.UniProt.renamed	A0A8N7UR26, E7F557	P08048, P17010
OG0000226	Human.UniProt.renamed	A0A8M9Q4E9, E9QF26	P32455, Q9H0R5, P32456, Q96PP8, Q8N8V2, Q96PP9, Q6ZN66
OG0000228	Human.UniProt.renamed	Q4KMK4	P13637
OG0000228	Human.UniProt.renamed	Q9DGL5	P50993, Q13733
OG0000228	Human.UniProt.renamed	Q90X33	P20648, P54707, P05023
OG0000229	Human.UniProt.renamed	A0A8M6Z208	Q8NDA8, Q6ZUA9, A6NGR9, Q68CQ1, Q9H579, A6NES4, Q7Z745, Q9BYG7
OG0000230	Human.UniProt.renamed	A0A8M1NE33	P0DMV9, P0DMV8, P48741, P17066, P34931
OG0000230	Human.UniProt.renamed	Q90473	P54652, P11142
OG0000231	Human.UniProt.renamed	Q6DFZ8	P17655
OG0000231	Human.UniProt.renamed	Q7ZUR1	A6NHC0, Q9UMQ6, Q6ZSI9, Q6MZZ7, A8MX76, P07384
OG0000232	Human.UniProt.renamed	X1WBH5, A0A8M1RQZ9, I3IST1, A0A8M1P3L9, A0A8M3AP29, A0A8M9QI12, A0A8M1RRE7, X1WCE1	A0A1W2PQ72
OG0000237	Human.UniProt.renamed	Q6NYN7	Q4U2R8, Q8TCC7, Q9NSA0, Q96S37, Q63ZE4, Q8N4F4, Q8IVM8, Q6T423
OG0000238	Human.UniProt.renamed	Q90YS5	Q6UWQ5, Q7Z4W2, Q8IXA5, Q96KX0, O75951, Q96QH8, P61626, P00709
OG0000241	Human.UniProt.renamed	A0A8M3B6M0	Q9UHC6
OG0000241	Human.UniProt.renamed	A0A8M3AUM4	Q8WYK1
OG0000241	Human.UniProt.renamed	A0A8M2B1Z8	Q9C0A0, Q96NU0, A0A1B0GTE1, Q9BZ76
OG0000242	Human.UniProt.renamed	A2BIR9, A0A8M9QDS3, A0A8M6Z6Z5, A0A8M2BCD3, Q7SXD8, B0S7I1, A0A8M3ASD7, Q7ZTV7	Q8N5D6
OG0000244	Human.UniProt.renamed	Q5U3D5, Q5TZ86, Q5TZ85, Q7ZU60, A0A8M1PZ56, Q5TZ75, A0A8M9PPW9, Q803J0	P51589
OG0000245	Human.UniProt.renamed	Q4V9I1, A9JSU2	P09871
OG0000245	Human.UniProt.renamed	X1WH68	P48740
OG0000245	Human.UniProt.renamed	A0A8M1NGF4	O00187
OG0000246	Human.UniProt.renamed	A0A8M9PQW6	O60840
OG0000246	Human.UniProt.renamed	A0A8M9PUS4	Q01668
OG0000246	Human.UniProt.renamed	A0A8M9Q050	Q13936
OG0000246	Human.UniProt.renamed	Q6RKB0, A0A8M2BFL7	Q13698
OG0000247	Human.UniProt.renamed	F6NQL8	Q9P1Z3
OG0000247	Human.UniProt.renamed	A0A8N7T6V3	Q9UL51
OG0000247	Human.UniProt.renamed	A0A0R4IRW0	O60741
OG0000247	Human.UniProt.renamed	A0A8N7TEJ3, A0A8N7UQR8	Q9Y3Q4
OG0000248	Human.UniProt.renamed	A0A8M1PI54	P01584, Q9UHA7, Q9NZH8, Q9NZH7, Q9NZH6, Q8WWZ1, Q9UBH0, P18510
OG0000249	Human.UniProt.renamed	A0A8M9P1T6, A0A8M9NZC6, Q3B7G4, E9QJG3, A0A8M1PVB3, O42364, Q503V2	P02647, P06727
OG0000250	Human.UniProt.renamed	A0A8M6YVV5, A0A8M9PYJ0, A0A8M9QGJ2, A0A8M9PV33, A0A8M6YYB8, A0A8M9P6I8, A0A8M6YWN1, A0A8M2BDT9	Q12913
OG0000262	Human.UniProt.renamed	Q1ECX3	P21980, P16452, P49221, Q96PF1, O43548, O95932, Q08188
OG0000263	Human.UniProt.renamed	A9JT69, Q90W33	Q96JB3, Q8NAF0, Q8NCA9, Q96K58, Q7Z7K2, Q5TEC3
OG0000264	Human.UniProt.renamed	F1R543	Q96HA1, A6NF01, A8CG34, P21754, Q6PJE2, Q96KW2, Q8N7R1
OG0000265	Human.UniProt.renamed	Q8AWD9	P07339
OG0000265	Human.UniProt.renamed	Q9DDE2	P14091, P20142, P0DJD8, P0DJD9, P0DJD7
OG0000267	Human.UniProt.renamed	A0A8M3AXQ6	Q9Y2H9
OG0000267	Human.UniProt.renamed	E7F723	Q6P0Q8
OG0000267	Human.UniProt.renamed	A0A8M3AXH0	O60307
OG0000267	Human.UniProt.renamed	A0A8M3AZY5	O15021
OG0000268	Human.UniProt.renamed	B8A492, A0A8M2B3Y9, B8A486, B8A489	Q96BM0, P09912, Q9H2X8, P40305
OG0000270	Human.UniProt.renamed	Q561Z7	P20151, P06870, A4D1T9, P07477, P07478, P35030, Q8NHM4
OG0000272	Human.UniProt.renamed	Q4VBJ2, Q6PHV5	P15085
OG0000272	Human.UniProt.renamed	F1QVD7, Q6GMH9	Q8WXQ8, Q9UI42, P48052
OG0000273	Human.UniProt.renamed	A0A8M9QFE6	P35749
OG0000273	Human.UniProt.renamed	A0A8M2BLU9, A0A8M1QUS6	P35579
OG0000273	Human.UniProt.renamed	A0A8M3BA62	Q7Z406, P35580
OG0000274	Human.UniProt.renamed	A9JRA7	Q53FZ2, Q6NUN0, Q6P461, P0C7M7, Q08AH1, Q08AH3, Q68CK6
OG0000277	Human.UniProt.renamed	A0A8M2B3U1	P12814
OG0000277	Human.UniProt.renamed	Q8AX99	Q08043
OG0000277	Human.UniProt.renamed	Q2YDR5	P35609
OG0000277	Human.UniProt.renamed	A0A8M9QH30	O43707
OG0000278	Human.UniProt.renamed	F1Q786, A0A286YBY6, A0A8M2BFX7, A0A0R4II19, A0A8M9QEY0, A0A8M9Q4X7, A0A8M6YYK8	Q15361
OG0000279	Human.UniProt.renamed	A0A0R4IMB2, A0A8M3ALC4, A0A8M1P7C1, F1QX13, Q3MU74, A0A8M1RQR9	P01024, Q6ZMU1
OG0000280	Human.UniProt.renamed	F1QNG0	O75164
OG0000280	Human.UniProt.renamed	Q1LUQ0	Q9H3R0, O94953, Q6B0I6, A0A1W2PPD8, B2RXH2
OG0000283	Human.UniProt.renamed	A0A8M9QJW3	P49792, O14715, Q99666, P0DJD1, P0DJD0, A6NKT7, Q7Z3J3
OG0000284	Human.UniProt.renamed	E7F5V6	Q13478
OG0000284	Human.UniProt.renamed	A0A8M9Q5Q6	Q9HB29, P14778, P27930, P18627, Q01638
OG0000285	Human.UniProt.renamed	A0A8M9PT78, F1R480, H2EQR6, A0A8M2BIB6	Q14126, Q02413, P32926, Q86SJ6
OG0000286	Human.UniProt.renamed	A0A8M9Q6G2, A0A8M9PLM0, A0A8M9PA93, A0A8M9Q393, A0A8M6Z0S6, B0UYL3	Q460N3, Q460N5
OG0000287	Human.UniProt.renamed	A0A8M9QKX8	Q9NT68
OG0000287	Human.UniProt.renamed	Q9W7R4	Q9P273
OG0000287	Human.UniProt.renamed	Q9W7R3	Q6N022
OG0000287	Human.UniProt.renamed	A0A8N7UV98	Q9UKZ4
OG0000288	Human.UniProt.renamed	A0A8M1Q6T7, A0A8M9PX16, A0A8M3AVQ9, A0A8M3ANY3, A0A8M9PWI0, A0A8M3AV10, A0A2R8QKL9	P22735
OG0000289	Human.UniProt.renamed	A0A0G2L893, D2CRG0, A0A2R8QJM0, A0A2R8RTX1, A0A2R8QI72, A0A8M1P827, E7F2M5	P13987
OG0000290	Human.UniProt.renamed	Q6DHC9, A0A8M1RRV3, A3KPY8, A0A8M1P7N7, Q4QRH5, A0A8M9PRR3, Q6AZC0	Q9UNI1
OG0000291	Human.UniProt.renamed	A0A8M2BCY7, A0A0R4IQ43, A2BHJ6, A0A0G2KM47, A0A0G2KWZ2, B0R191, A0A0R4INB9	O14625
OG0000312	Human.UniProt.renamed	Q7ZTR9	Q5VYY2, P38571, Q5VXI9, Q5W064, Q5VXJ0, P07098
OG0000313	Human.UniProt.renamed	U3N867	Q14831
OG0000313	Human.UniProt.renamed	A0A8N7UTB5	Q14833
OG0000313	Human.UniProt.renamed	E7FH00	O00222
OG0000315	Human.UniProt.renamed	Q5U3E4	Q9Y2Z0, Q9H2J1, Q5SR53, Q8N769, Q3ZCU0, Q6ZUF6
OG0000316	Human.UniProt.renamed	Q6NXA6	P11766, P28332, P40394, P07327, P00325, P00326
OG0000317	Human.UniProt.renamed	E7FB64	P13584, Q02928, Q5TCH4, Q8N118, Q86W10, Q8N1L4
OG0000318	Human.UniProt.renamed	Q5RGW3	Q8N4U5
OG0000318	Human.UniProt.renamed	Q58EK1	Q8WWU5, Q5H9J9, B4DZS4, Q9NUJ3
OG0000319	Human.UniProt.renamed	A0A8M2BA14	Q9Y666
OG0000319	Human.UniProt.renamed	A0A8M9Q103	Q9H2X9
OG0000319	Human.UniProt.renamed	F1QBW2	Q9UHW9, Q9UP95
OG0000320	Human.UniProt.renamed	F1QPW7	P18505
OG0000320	Human.UniProt.renamed	A0A8M1N6N1	P47870
OG0000320	Human.UniProt.renamed	A0A8M2BDH7	P28472
OG0000321	Human.UniProt.renamed	A0A8M9QBR5, A0A8M9Q728	P07910, B2RXH8, O60812, B7ZW38, P0DMR1
OG0000322	Human.UniProt.renamed	A0A0R4IBL7	Q99081
OG0000322	Human.UniProt.renamed	A0A8M9P3H6	P15884
OG0000322	Human.UniProt.renamed	B1H1L4, Q90491	P15923
OG0000323	Human.UniProt.renamed	A0A8M6Z8T4, A0A8M9QDU6	O75369
OG0000323	Human.UniProt.renamed	A0A8M9PT53	P21333
OG0000323	Human.UniProt.renamed	A0A8M9PHR9	Q14315
OG0000324	Human.UniProt.renamed	A0A8M3AP68	P51812
OG0000324	Human.UniProt.renamed	Q6PFQ0	Q9UK32
OG0000324	Human.UniProt.renamed	E7F164	Q15418, Q15349
OG0000325	Human.UniProt.renamed	A3FKT8, Q6XG62	P26447, P29034, P33763, P06703, P33764
OG0000326	Human.UniProt.renamed	A0A8M9Q9K2	Q9Y4K4
OG0000326	Human.UniProt.renamed	A0A8M3B704	Q8IVH8
OG0000326	Human.UniProt.renamed	Q1RLZ2	Q92918, Q12851
OG0000328	Human.UniProt.renamed	A0A8N7T7Z7	P54278, Q68D20, Q13401, O95744, A4D2B8, A8MQ11
OG0000330	Human.UniProt.renamed	A0A8M1RS57, A0A8M2BKN8, A0A8M1RNU2, A0A8M9NYX7, A0A8M2BKN9, F1RB95	Q9UBS8
OG0000331	Human.UniProt.renamed	A0A0R4IR84	P52848
OG0000331	Human.UniProt.renamed	A0A8M9PU51	P52849
OG0000331	Human.UniProt.renamed	A0A8M9Q484	Q9H3R1, O95803
OG0000333	Human.UniProt.renamed	Q804W1, Q804W0, Q9I8V0, Q7ZT36, Q6IMW7, Q804V9	P20472
OG0000334	Human.UniProt.renamed	A0A8M9PHT6	P50570
OG0000334	Human.UniProt.renamed	A0A8M9PJL9	Q9UQ16, Q05193, Q6ZS02, Q6PK57
OG0000337	Human.UniProt.renamed	O13168	Q04726, A0A1W2PR48, Q9H808, Q04725, Q04724, Q04727
OG0000338	Human.UniProt.renamed	A0A8M3B6F5	P20023, P17927, Q2VPA4, P08174, P04003, P15529
OG0000340	Human.UniProt.renamed	A0A8M9Q9B3, A0A8M9P741	Q8N436
OG0000340	Human.UniProt.renamed	A0A0R4IUK4, A0A8M9PYE2	Q8IUX7, Q96SM3
OG0000341	Human.UniProt.renamed	F1QB54	P0CB38, Q96DU9, Q4VXU2, Q5JQF8, Q9H361, P11940
OG0000344	Human.UniProt.renamed	Q6DGT8	P04271, P25815, P29377, Q07283, Q5D862, Q86YZ3
OG0000345	Human.UniProt.renamed	A0A8N7T7H9, B3DKF1	Q14D33, Q96DX8, Q9BQQ7, P59025, Q5QGT7
OG0000346	Human.UniProt.renamed	B3DJD4	Q9NYB5, F5H094, G3V0H7, Q9NPD5, Q9Y6L6, P46721
OG0000347	Human.UniProt.renamed	Q90ZZ8, E9QH31	P30838, P51648
OG0000347	Human.UniProt.renamed	Q7ZU10	P43353, P48448
OG0000348	Human.UniProt.renamed	A3KP35	Q6NT55, Q08477, P78329, P98187, Q9HCS2, Q9HBI6
OG0000349	Human.UniProt.renamed	A0AUQ5	Q1A5X6
OG0000349	Human.UniProt.renamed	A0A8M3BCY2, A0A8M6YZD9, Q568A8	B3KU38, P0DPB3
OG0000350	Human.UniProt.renamed	Q7ZVL7	P52789
OG0000350	Human.UniProt.renamed	Q7ZUM3	P19367
OG0000350	Human.UniProt.renamed	B8A5H6	Q2TB90
OG0000351	Human.UniProt.renamed	A0A8M9Q1H6, A0A8M9PYC8, A0A8M9QLI5	M0QZC1
OG0000351	Human.UniProt.renamed	A0A8M2BDI7, A0A8M2B978	E7ERA6
OG0000352	Human.UniProt.renamed	A0A0K1H367, A0A0K1H345, E7FAR9, A0A8M9PV89, Q7T3Q1, A0A8M6YT64	P22749
OG0000353	Human.UniProt.renamed	A0A8M9Q5T9	P20020
OG0000353	Human.UniProt.renamed	A0A8M9PWI4	Q16720
OG0000353	Human.UniProt.renamed	B2CZB8	Q01814
OG0000354	Human.UniProt.renamed	A0A8M3ANV7, A0A8M9PNI2, A0A8M3B6Y1, A0A8M3AZF0, A0A8M6YYH8, Q66HV5	O00534
